<?xml version="1.0" encoding="UTF-8"?>
<wilma-stub xmlns="http://epam.github.io/Wilma/xsd/StubConfig" xmlns:xsi="http://www.w3.org/2001/XMLSchema-instance"
            xsi:schemaLocation="http://epam.github.io/Wilma/xsd/StubConfig http://epam.github.io/Wilma/xsd/StubConfig.xsd" groupname="ForwardProxy">
    <dialog-descriptor name="ForwardProxyExampleConfiguration" usage="always" comment="Forward Proxy">
        <condition-descriptor>
                <condition class="AlwaysFalseChecker" />
        </condition-descriptor>
        <response-descriptor code="200" delay="0" mimetype="text/plain" template="forwardProxyTemplate">
        </response-descriptor>
    </dialog-descriptor>
    <template-descriptor name="templateDescriptor1">
        <template name="forwardProxyTemplate" type="text" resource="Dummy response."/>
    </template-descriptor>
    <interceptors>
        <interceptor name="Forward Proxy Interceptor" class="com.epam.wilma.extras.forwardproxy.ForwardProxyInterceptor" />
    </interceptors>
</wilma-stub>