<?xml version="1.0" encoding="UTF-8"?>
<wilma-stub xmlns="http://epam.github.io/Wilma/xsd/StubConfig" xmlns:xsi="http://www.w3.org/2001/XMLSchema-instance"
  xsi:schemaLocation="http://epam.github.io/Wilma/xsd/StubConfig http://epam.github.io/Wilma/xsd/StubConfig.xsd">
  
   <sequence-descriptor name="default-sequenceDescriptorName" class="com.epam.message.sequence.test.SingleSequenceHandler" timeout="120000">
        <dialog-descriptors>
			<dialog-descriptor-ref ref="super-descriptor"/>      
        </dialog-descriptors>
    </sequence-descriptor>

  <dialog-descriptor name="super-descriptor" usage="always" comment="random comment">
    <condition-descriptor>
      <condition class="AlwaysTrueChecker"/>
    </condition-descriptor>
    <response-descriptor code="200" delay="0" mimetype="text/plain" template="notUsedResponse" sequenceDescriptorName="default-sequenceDescriptorName">
      <template-formatter class="com.epam.message.sequence.test.SequenceBodyTemplateFormatter"/>
    </response-descriptor>
  </dialog-descriptor>
  
  <template-descriptor name="template-descriptor_1">
    <template name="notUsedResponse" type="text" resource="Not used :)" />
  </template-descriptor>
</wilma-stub>