<?xml version="1.0" encoding="UTF-8"?>
<wilma-stub xmlns="http://epam.github.io/Wilma/xsd/StubConfig" xmlns:xsi="http://www.w3.org/2001/XMLSchema-instance"
  xsi:schemaLocation="http://epam.github.io/Wilma/xsd/StubConfig http://epam.github.io/Wilma/xsd/StubConfig.xsd">
  <dialog-descriptor name="dialog-descriptor" usage="always" comment="random comment">
    <condition-descriptor>
      <condition class="OrPatternChecker" />
    </condition-descriptor>
    <response-descriptor code="404" delay="0" mimetype="json" template="exampleTemplate1">
      <template-formatter class="XslBasedTemplateFormatter">
        <param name="param1" value="value1" />
        <param name="param2" value="value2" />
      </template-formatter>
      <template-formatter-set-invoker name="templateFormatterSet1"/>
    </response-descriptor>
  </dialog-descriptor>
  <template-descriptor name="templateDescriptor1">
  <template name="exampleTemplate1" type="xml" resource="something"/>
  <template-formatter-set name="templateFormatterSet1">
  <template-formatter class="InvalidClassFormatExternalTemplateFormatter"/>
  </template-formatter-set>
  </template-descriptor>
</wilma-stub>
