<?xml version="1.0" encoding="UTF-8"?>
<wilma-stub xmlns="http://epam.github.io/Wilma/xsd/StubConfig" xmlns:xsi="http://www.w3.org/2001/XMLSchema-instance"
            xsi:schemaLocation="http://epam.github.io/Wilma/xsd/StubConfig http://epam.github.io/Wilma/xsd/StubConfig.xsd" groupname="ShortCircuit">
    <dialog-descriptor name="ShortCircuitExampleConfiguration" usage="always" comment="Short Circuit, with 6 hour cache timeout">
        <condition-descriptor>
            <and>
                <condition class="OrUrlPatternChecker" >
                    <param name="dummy" value="http://" />
                    <param name="dummy" value="https://" />
                </condition>
                <condition class="com.epam.wilma.extras.shortcircuit.ShortCircuitChecker" />
            </and>
        </condition-descriptor>
        <response-descriptor code="200" delay="0" mimetype="text/plain" template="shortCircuitTemplate">
            <template-formatter class="com.epam.wilma.extras.shortcircuit.ShortCircuitResponseGenerator"/>
        </response-descriptor>
    </dialog-descriptor>
    <template-descriptor name="templateDescriptor1">
        <template name="shortCircuitTemplate" type="external" resource="com.epam.wilma.extras.shortcircuit.ShortCircuitResponseGenerator"/>
    </template-descriptor>
    <interceptors>
        <interceptor name="ShortCircuit Response Catcher" class="com.epam.wilma.extras.shortcircuit.ShortCircuitInterceptor">
            <param name="timeout" value="21600000" />
        </interceptor>
    </interceptors>
</wilma-stub>