<?xml version="1.0" encoding="UTF-8"?>
<wilma-stub xmlns="http://epam.github.io/Wilma/xsd/StubConfig" xmlns:xsi="http://www.w3.org/2001/XMLSchema-instance"
  xsi:schemaLocation="http://epam.github.io/Wilma/xsd/StubConfig http://epam.github.io/Wilma/xsd/StubConfig.xsd">
  <dialog-descriptor name="dialog-descriptor1" usage="always" validityValue="2" comment="random comment">
    <condition-descriptor>
      <condition class="OrPatternChecker">
        <param name="StringCheck" value="exampleID=&quot;456&quot;" />
      </condition>
    </condition-descriptor>
    <response-descriptor code="200" delay="0" mimetype="application/xml" template="xmlTemplate">
    </response-descriptor>
  </dialog-descriptor>
  <template-descriptor name="template-descriptor_1">
    <template name="xmlTemplate" type="text" resource="%lt;?xml version=&quot;1.0&quot; encoding=&quot;UTF-8&quot;?%gt;" />
  </template-descriptor>
</wilma-stub>
