<?xml version="1.0" encoding="UTF-8"?>
<wilma-stub xmlns="http://epam.github.io/Wilma/xsd/StubConfig" xmlns:xsi="http://www.w3.org/2001/XMLSchema-instance"
            xsi:schemaLocation="http://epam.github.io/Wilma/xsd/StubConfig http://epam.github.io/Wilma/xsd/StubConfig.xsd" groupname="Replicator">
    <dialog-descriptor name="Simple Answer" usage="always">
        <condition-descriptor>
            <condition class="AndUrlPatternChecker">
                <param name="test1OK" value="dummy"/>
            </condition>
        </condition-descriptor>
        <response-descriptor code="200" delay="0" mimetype="text/plain" template="replicatedResponseTemplate">
        </response-descriptor>
    </dialog-descriptor>
    <template-descriptor name="templateDescriptor">
        <template name="replicatedResponseTemplate" type="text" resource="Replicator Example Dummy Response"/>
    </template-descriptor>
    <interceptors>
        <interceptor name="replicator" class="com.epam.wilma.extras.replicator.interceptor.ReplicatorInterceptor">
            <param name="https://github.com/epam/Wilma/tree/master/wilma-extras/replicator" value="http://localhost:9090/replicator" />
        </interceptor>
    </interceptors>
</wilma-stub>